id,entrez_name,entrez_id,name,description,gene_id,type,variant_types/0/id,variant_types/0/name,variant_types/0/display_name,variant_types/0/so_id,variant_types/0/description,variant_types/0/url,coordinates/chromosome,coordinates/start,coordinates/stop,coordinates/reference_bases,coordinates/variant_bases,coordinates/representative_transcript,coordinates/chromosome2,coordinates/start2,coordinates/stop2,coordinates/representative_transcript2,coordinates/ensembl_version,coordinates/reference_build,variant_types/1/id,variant_types/1/name,variant_types/1/display_name,variant_types/1/so_id,variant_types/1/description,variant_types/1/url
1,ABL1,25,BCR-ABL,"The BCR-ABL fusion protein, commonly referred to as the Philadelphia chromosome, is one of the most studied fusion genes in cancer. It has widely been considered the initiating event in chronic myelogenous leukemia (CML). However, despite its ability to initiate disease in mice, its status as an initiating mutation is in dispute. In what is commonly used as the poster-child for targeted therapeutics, the development and use of imatinib in the clinic has led to profound improvements in the prognosis of the disease. However, imatinib resistance is still seen in patients with mutations in the ABL kinase domain of the fusion, most notably the T315I variant. In patients resistant to imatinib, either acquired or otherwise, second generation BCR-ABL TKI's (dasatinib and nilotinib) have seen some success in delivering a tumor response. Third generation ABL1 inhibitor ponatinib is the only FDA approved drug with activity against T315I . However due to risk of life-threatening blood clots and severe narrowing of blood vessels ponatinib is ONLY approved for T315I-positive CML or T315I-positive Ph+ ALL or in cases of CML, Ph+ ALL with resistance or intolerance to other approved ABL1 inhibitors.",4,variant,120,transcript_fusion,Transcript Fusion,SO:0001886,A feature fusion where the deletion brings together transcript regions.,http://www.sequenceontology.org/browser/current_svn/term/SO:0001886,22,23522397,23632600,,,ENST00000305877.8,9,133729451,133763063,ENST00000318560.5,75,GRCh37,,,,,,
2,ABL1,25,BCR-ABL T334I,"While the efficacy of imatinib has revolutionized chronic myelogenous leukemia (CML) treatment, it is still not a cure-all. Both initial resistance and acquired resistance as a result of selection have been seen in a small subset of CML patients. The ABL kinase domain mutation T315I (aka T334I) has been shown to be one such mutation that confers resistance to imatinib. Second generation TKI's (dasatinib and ponatinib) specific to BCR-ABL have shown efficacy in treating resistant cases.",4,variant,47,missense_variant,Missense Variant,SO:0001583,"A sequence variant, that changes one or more bases, resulting in a different amino acid sequence but where the length is preserved.",http://www.sequenceontology.org/browser/current_svn/term/SO:0001583,9,133748283,133748283,C,T,ENST00000372348.2,,,,,75,GRCh37,120,transcript_fusion,Transcript Fusion,SO:0001886,A feature fusion where the deletion brings together transcript regions.,http://www.sequenceontology.org/browser/current_svn/term/SO:0001886
3,ABL1,25,BCR-ABL E255K,"While the efficacy of imatinib has revolutionized chronic myelogenous leukemia (CML) treatment, it is still not a cure-all. Both initial resistance and acquired resistance as a result of selection have been seen in a small subset of CML patients. The ABL kinase domain mutation E255K has been shown to be one such mutation that confers resistance to imatinib. Second generation TKI's (dasatinib and nilotinib) specific to BCR-ABL have shown efficacy in treating resistant cases.",4,variant,47,missense_variant,Missense Variant,SO:0001583,"A sequence variant, that changes one or more bases, resulting in a different amino acid sequence but where the length is preserved.",http://www.sequenceontology.org/browser/current_svn/term/SO:0001583,9,133738363,133738363,G,A,ENST00000318560.5,,,,,75,GRCh37,120,transcript_fusion,Transcript Fusion,SO:0001886,A feature fusion where the deletion brings together transcript regions.,http://www.sequenceontology.org/browser/current_svn/term/SO:0001886
4,AKT1,207,E17K,"AKT1 E17K is a recurrent mutation that has been observed in breast, colorectal, lung, and ovarian cancer. It has been convincingly shown to be an activating mutation resulting in PI3K/AKT/mTOR pathway activity. It has been suggested that this mutation decreases the cell's sensitivity to AKT1 allosteric kinase inhibitors. This, and other AKT1 mutations, are the subject of much research and development for therapeutics.",2,variant,47,missense_variant,Missense Variant,SO:0001583,"A sequence variant, that changes one or more bases, resulting in a different amino acid sequence but where the length is preserved.",http://www.sequenceontology.org/browser/current_svn/term/SO:0001583,14,105246551,105246551,C,T,ENST00000407796.2,,,,,75,GRCh37,,,,,,
5,ALK,238,EML4-ALK,"The EML4-ALK fusion variant 1 consisting of ALK kinase domain (exons 20-29) fused to EML4 exons 1-13 is the most common EML4-ALK variant, and was discovered in non-small cell lung cancer. Multiple EML4 breakpoint shave been described with differential sensitivity to inhibitors with variant 1 showing greater sensitivity than 3a in cell lines. EML4-ALK is crizotinib sensitive; however, several mutations that confer resistance mutations have been described in case studies. In the only clinical trial for crizotinib that included determination of EML4-ALK variant type in a subset of its participants, a very high response rate was observed, although the numbers were insufficient to validate correlation of variant type to outcome. Preclinical studies with this variant have indicated sensitivity to Hsp90 inhibitors.",1,variant,120,transcript_fusion,Transcript Fusion,SO:0001886,A feature fusion where the deletion brings together transcript regions.,http://www.sequenceontology.org/browser/current_svn/term/SO:0001886,2,42396490,42522656,,,ENST00000318522.5,2,29415640,29446394,ENST00000389048.3,75,GRCh37,,,,,,
6,ALK,238,EML4-ALK C1156Y,"In patients with non-small cell lung cancer exhibiting EML4-ALK fusion, C1156Y has been shown to confer resistance to crizotinib. Case reports indicate that secondary mutations can modulate drug sensitivity. EML4-ALK C1156Y/L1196M maintained crizotinib resistance while the lorlatinib resistant combination EML4-ALK C1156Y/L1198F re-sensitized the tumor to crizotinib treatment.",1,variant,47,missense_variant,Missense Variant,SO:0001583,"A sequence variant, that changes one or more bases, resulting in a different amino acid sequence but where the length is preserved.",http://www.sequenceontology.org/browser/current_svn/term/SO:0001583,2,29445258,29445258,C,T,ENST00000389048.3,,,,,75,GRCh37,120,transcript_fusion,Transcript Fusion,SO:0001886,A feature fusion where the deletion brings together transcript regions.,http://www.sequenceontology.org/browser/current_svn/term/SO:0001886
7,ALK,238,EML4-ALK L1196M,"In patients with non-small cell lung cancer exhibiting EML4-ALK fusion, L1196M has been shown to confer resistance to crizotinib. This was also true in a patient with both EML4-ALK C1156Y & L1196M.",1,variant,47,missense_variant,Missense Variant,SO:0001583,"A sequence variant, that changes one or more bases, resulting in a different amino acid sequence but where the length is preserved.",http://www.sequenceontology.org/browser/current_svn/term/SO:0001583,2,29443631,29443631,G,T,ENST00000389048.3,,,,,75,GRCh37,120,transcript_fusion,Transcript Fusion,SO:0001886,A feature fusion where the deletion brings together transcript regions.,http://www.sequenceontology.org/browser/current_svn/term/SO:0001886
8,ALK,238,F1174L,"ALK F1174L has been observed as recurrent in neuroblastoma, non-small cell lung cancer (NSCLC), and other cancer types. Neuroblastoma cells containing this mutation have shown resistance to low doses of criztonib. However, increased dosage can overcome this resistance in cell lines studies. TAE684 has also proven effective in both NSCLC and neuroblastoma F1174L containing cells.",1,variant,47,missense_variant,Missense Variant,SO:0001583,"A sequence variant, that changes one or more bases, resulting in a different amino acid sequence but where the length is preserved.",http://www.sequenceontology.org/browser/current_svn/term/SO:0001583,2,29443695,29443695,G,T,ENST00000389048.3,,,,,75,GRCh37,,,,,,
9,ALK,238,R1275Q,"ALK R1275Q has been observed as a recurrent mutation in  neuroblastoma, non-small cell lung cancer (NSCLC), as well as other cancer types. Neuroblastoma cells with this mutation have shown sensitivity to the ALK-inhibitor TAE684. This and the geldanamycin deriviative 17-DMAG have been shown to be effective in NSCLC cell lines.",1,variant,47,missense_variant,Missense Variant,SO:0001583,"A sequence variant, that changes one or more bases, resulting in a different amino acid sequence but where the length is preserved.",http://www.sequenceontology.org/browser/current_svn/term/SO:0001583,2,29432664,29432664,C,T,ENST00000389048.3,,,,,75,GRCh37,,,,,,
10,ARAF,369,S214C,"ARAF S214C has been found to be a recurrent oncogenic mutation in non-small cell lung cancer. It has been shown to confer sensitivity to sorafenib and trametenib in cell lines. In a case study of advanced stage lung adenocarcinoma harboring this mutation, sorafenib also acheived near-complete clinical remission. This case has brought more interest to the variant from a research and clinical perspective.",3,variant,47,missense_variant,Missense Variant,SO:0001583,"A sequence variant, that changes one or more bases, resulting in a different amino acid sequence but where the length is preserved.",http://www.sequenceontology.org/browser/current_svn/term/SO:0001583,X,47426121,47426121,C,G,ENST00000377045.4,,,,,75,GRCh37,,,,,,
11,BRAF,673,V600D,"Patients harboring mutations in valine 600 residue of BRAF have been shown to be sensitive to dabrafenib. For more information on the V600 locus, see the V600E entry.",5,variant,47,missense_variant,Missense Variant,SO:0001583,"A sequence variant, that changes one or more bases, resulting in a different amino acid sequence but where the length is preserved.",http://www.sequenceontology.org/browser/current_svn/term/SO:0001583,7,140453135,140453136,CA,TA,ENST00000288602.6,,,,,75,GRCh37,,,,,,
12,BRAF,673,V600E,"BRAF V600E has been shown to be recurrent in many cancer types. It is one of the most widely studied variants in cancer. This variant is correlated with poor prognosis in certain cancer types, including colorectal cancer and papillary thyroid cancer. The targeted therapeutic dabrafenib has been shown to be effective in clinical trials with an array of BRAF mutations and cancer types. Dabrafenib has also shown to be effective when combined with the MEK inhibitor trametinib in colorectal cancer and melanoma. However, in patients with TP53, CDKN2A and KRAS mutations, dabrafenib resistance has been reported. Ipilimumab, regorafenib, vemurafenib, and a number of combination therapies have been successful in treating V600E mutations. However, cetuximab and panitumumab have been largely shown to be ineffective without supplementary treatment.",5,variant,47,missense_variant,Missense Variant,SO:0001583,"A sequence variant, that changes one or more bases, resulting in a different amino acid sequence but where the length is preserved.",http://www.sequenceontology.org/browser/current_svn/term/SO:0001583,7,140453136,140453136,A,T,ENST00000288602.6,,,,,75,GRCh37,,,,,,
13,BRAF,673,V600E+V600M,"A case study of a single patient harboring both a V600E and a V600M mutation, dabrafenib was shown to acheive clinical response.",5,variant,47,missense_variant,Missense Variant,SO:0001583,"A sequence variant, that changes one or more bases, resulting in a different amino acid sequence but where the length is preserved.",http://www.sequenceontology.org/browser/current_svn/term/SO:0001583,7,140453135,140453137,,,ENST00000288602.6,,,,,75,GRCh37,,,,,,
14,BRAF,673,V600E AMPLIFICATION,"Amplification of BRAF V600E has been shown to confer resistance to MEK inhibitors. For more information on the V600 locus, see the V600E entry.",5,variant,47,missense_variant,Missense Variant,SO:0001583,"A sequence variant, that changes one or more bases, resulting in a different amino acid sequence but where the length is preserved.",http://www.sequenceontology.org/browser/current_svn/term/SO:0001583,7,140434279,140624564,,,ENST00000288602.6,,,,,75,GRCh37,123,transcript_amplification,Transcript Amplification,SO:0001889,A feature amplification of a region containing a transcript.,http://www.sequenceontology.org/browser/current_svn/term/SO:0001889
17,BRAF,673,V600,"BRAF mutations of the valine 600 residue have been shown to be recurrent in many cancer types. Of the V600 mutations, V600E is the most widely researched. V600 mutations as a whole have been correlated to poorer prognosis in colorectal and papilarry thyroid cancers. V600 mutations have also been shown to confer sensitivity to the BRAF inhibitor dabrafenib. For a more detailed summary, click the individual mutations.",5,variant,103,protein_altering_variant,Protein Altering Variant,SO:0001818,A sequence_variant which is predicted to change the protein encoded in the coding sequence.,http://www.sequenceontology.org/browser/current_svn/term/SO:0001818,7,140453136,140453137,,,ENST00000288602.6,,,,,75,GRCh37,,,,,,
18,CCND1,595,AMPLIFICATION,CCND1 amplification has been implicated in poorer prognosis in non-small cell lung cancer.,8,variant,123,transcript_amplification,Transcript Amplification,SO:0001889,A feature amplification of a region containing a transcript.,http://www.sequenceontology.org/browser/current_svn/term/SO:0001889,11,69455855,69469242,,,ENST00000227507.2,,,,,75,GRCh37,,,,,,
19,CCND1,595,EXPRESSION,"CCND1 expression, and its prognositc impact, is still in dispute. Three experiments in non-small cell lung cancer have shown it to have no impact on survival, but three additional studies have shown it results in poorer prognosis. There is also some ambiguity in how the boundaries between expression and overexpression are defined.",8,variant,183,N/A,N/A,N/A,No suitable Sequence Ontology term exists.,http://www.sequenceontology.org/browser/current_svn/term/N/A,11,69455855,69469242,,,ENST00000227507.2,,,,,75,GRCh37,,,,,,
20,CCND1,595,OVEREXPRESSION,"Cyclin D has been shown in many cancer types to be misregulated. Well established for their oncogenic properties, the cyclins and the cyclin-dependent kinases (CDK's) they activate have been the focus of major research and development efforts over the past decade. The methods by which the cyclins are misregulated are widely variable, and range from genomic amplification to promoter methylation changes. While Cyclin D2 has only been found to be significantly misregulated in glioma, Cyclin D1 in particular seems to be a pan-cancer actor. Cyclin D misregulation has been shown to lead to poorer outcomes in a number of studies, and currently there are no FDA-approved targeted therapies.",8,variant,183,N/A,N/A,N/A,No suitable Sequence Ontology term exists.,http://www.sequenceontology.org/browser/current_svn/term/N/A,11,69455855,69469242,,,ENST00000227507.2,,,,,75,GRCh37,,,,,,
21,CCND2,894,OVEREXPRESSION,"Cyclin D has been shown in many cancer types to be misregulated. Well established for their oncogenic properties, the cyclins and the cyclin-dependent kinases (CDK's) they activate have been the focus of major research and development efforts over the past decade. The methods by which the cyclins are misregulated are widely variable, and range from genomic amplification to promoter methylation changes. While Cyclin D2 has only been found to be significantly misregulated in glioma, Cyclin D1 in particular seems to be a pan-cancer actor. Cyclin D misregulation has been shown to lead to poorer outcomes in a number of studies, and currently there are no FDA-approved targeted therapies.",9,variant,183,N/A,N/A,N/A,No suitable Sequence Ontology term exists.,http://www.sequenceontology.org/browser/current_svn/term/N/A,12,4382938,4414516,,,ENST00000261254.3,,,,,75,GRCh37,,,,,,
22,CCND2,894,PROMOTER DEMETHYLATION,"Cyclin D has been shown in many cancer types to be misregulated. Well established for their oncogenic properties, the cyclins and the cyclin-dependent kinases (CDK's) they activate have been the focus of major research and development efforts over the past decade. The methods by which the cyclins are misregulated are widely variable, and range from genomic amplification to promoter methylation changes. While Cyclin D2 has only been found to be significantly misregulated in glioma, Cyclin D1 in particular seems to be a pan-cancer actor. Cyclin D misregulation has been shown to lead to poorer outcomes in a number of studies, and currently there are no FDA-approved targeted therapies.",9,variant,183,N/A,N/A,N/A,No suitable Sequence Ontology term exists.,http://www.sequenceontology.org/browser/current_svn/term/N/A,12,4381437,4382937,,,ENST00000261254.3,,,,,75,GRCh37,,,,,,
23,CCND3,896,LOSS,"Cyclin D has been shown in many cancer types to be misregulated. Well established for their oncogenic properties, the cyclins and the cyclin-dependent kinases (CDK's) they activate have been the focus of major research and development efforts over the past decade. The methods by which the cyclins are deregulated are widely variable, and range from genomic amplification to promoter methylation changes. Cyclin D3 loss has been reported in T-cell acute lymphoblastic leukemia (T-ALL), a seemingly unique trend when compared to the amplifcations and overexpressions of the other cyclin D's. Treating cyclin D3 knockout mice with the targeted therapeutic palbociclib significantly increased the median survival of a Notch-driven model of T-ALL.",10,variant,161,loss_of_function_variant,Loss Of Function Variant,SO:0002054,A sequence variant whereby the gene product has diminished or abolished function.,http://www.sequenceontology.org/browser/current_svn/term/SO:0002054,6,41902671,41909586,,,ENST00000372991.4,,,,,75,GRCh37,,,,,,
24,CCNE1,898,OVEREXPRESSION,"Cyclin E, while currenly not as widely implicated as its counterpart, cyclin D, has been implicated in various carcinomas, including breast, gastric, stomach and colorectal. High levels of cyclin E, either by gene amplification or overexpression, are correlated with later stage disease and have been shown to lead to poorer prognosis in gastic carcinoma. It has also been shown, in lung cancer specifically, that neoplastic cells with higher levels of the cyclin E/CDK2 complex are more radiosensitive than their lowly expressed counterparts.",11,variant,183,N/A,N/A,N/A,No suitable Sequence Ontology term exists.,http://www.sequenceontology.org/browser/current_svn/term/N/A,19,30302805,30315215,,,ENST00000262643.3,,,,,75,GRCh37,,,,,,
25,CDK4,1019,EXPRESSION,"CDK4, along with its partner CDK6, are key players in cell cycle progression. The complex has been implicated in a number of cancer types, and is the focus of therapeutic research and development. One targeted therapy for CDK inhibition is palbociclib, which may slow the growth of advanced stage breast cancers. It has also been shown, in mouse, that CDK inhibition may sensitize mutant PIK3CA tumors to PI3K inhibitors.",13,variant,183,N/A,N/A,N/A,No suitable Sequence Ontology term exists.,http://www.sequenceontology.org/browser/current_svn/term/N/A,12,58141510,58146304,,,ENST00000257904.6,,,,,75,GRCh37,,,,,,
27,CDKN2A,1029,PROMOTER HYPERMETHYLATION,"CDKN2A loss has been shown to be a significant event in a number of cancer types. One mechanism by which this can occur is by hypermethylation of the CDKN2A promoter region. While no targeted therapeutic has been engaged in clinical trials, the prognostic impact has been studied by a number of meta-analyses. The prognostic impact of promoter hypermethylation has been relatively ambiguous. Many studies have shown significant p-values suggesting poorer prognostic outcomes for patients with hypermethylation in colorectal, liver, and younger lung cancer patients. This being said, there is still research to be done before this becomes a widely-accepted prognostic indicator.",14,variant,183,N/A,N/A,N/A,No suitable Sequence Ontology term exists.,http://www.sequenceontology.org/browser/current_svn/term/N/A,9,21974827,21994591,,,ENST00000498124.1,,,,,75,GRCh37,,,,,,
28,CEBPA,1050,N-TERMINAL FRAME SHIFT,"CEBPA N-terminal frame shift mutations that result in a premature stop codon are associated with cytogenetically normal acute myeloid leukemia (CN-AML). CEBPA mutations are associated with a favorable prognosis; however, NPM1 and FLT3 mutations should also be assessed in CN-AML patients as concurrent mutations may have prognostic implications. N-terminal frame shift mutations within amino acids 1-120 have been shown to disrupt expression of the full-length 42kDa isoform while maintaining expression of a 30kDa isoform (translated from the AUG at full-length protein isoform amino acid M120). This 30kDa isoform exhibits dominant negative activity.",15,variant,134,frameshift_truncation,Frameshift Truncation,SO:0001910,A frameshift variant that causes the translational reading frame to be shortened relative to the reference feature.,http://www.sequenceontology.org/browser/current_svn/term/SO:0001910,19,33792961,33793470,,,ENST00000498907.2,,,,,75,GRCh37,159,dominant_negative_variant,Dominant Negative Variant,SO:0002052,A variant where the mutated gene product adversely affects the other (wild type) gene product.,http://www.sequenceontology.org/browser/current_svn/term/SO:0002052
29,CEBPA,1050,MUTATION,"CEBPA mutations are associated with cytogenetically normal acute myeloid leukemia (CN-AML) and a favorable prognosis. However, NPM1 and FLT3 mutations should also be assessed in CN-AML patients as concurrent mutations may have prognostic implications.",15,variant,42,transcript_variant,Transcript Variant,SO:0001576,A sequence variant that changes the structure of the transcript.,http://www.sequenceontology.org/browser/current_svn/term/SO:0001576,19,33790840,33793470,,,ENST00000498907.2,,,,,75,GRCh37,161,loss_of_function_variant,Loss Of Function Variant,SO:0002054,A sequence variant whereby the gene product has diminished or abolished function.,http://www.sequenceontology.org/browser/current_svn/term/SO:0002054
30,CSF1R,1436,MEF2D-CSF1R,"MEF2D-CSF1R is a fusion that has been observed in acute lymphocytic leukemia. In cell lines harboring this event, treatment with imatinib has shown notable sensitivity.",33,variant,120,transcript_fusion,Transcript Fusion,SO:0001886,A feature fusion where the deletion brings together transcript regions.,http://www.sequenceontology.org/browser/current_svn/term/SO:0001886,1,156446804,156470620,,,ENST00000348159.4,5,149433787,149441412,ENST00000286301.3,75,GRCh37,,,,,,
31,PRKACA,5566,DNAJB1-PRKACA,"This fusion has been found to be very recurrent in the rare form of adolescent liver cancer, fibrolamellar hepatocellular carcinoma. In one study, this fusion was observed in 15/15 FL-HCC cases examined and functional studies found that the fusion retained kinase activity. The presence of this fusion may be used as a diagnostic marker for this rare tumor type.",17,variant,120,transcript_fusion,Transcript Fusion,SO:0001886,A feature fusion where the deletion brings together transcript regions.,http://www.sequenceontology.org/browser/current_svn/term/SO:0001886,19,14628951,14629232,,,ENST00000254322.2,19,14202500,14218221,ENST00000308677.4,75,GRCh37,,,,,,
32,DNMT3A,1788,R882,"DNMT3A R882 mutations are associated with cytogenetically normal acute myeloid leukemia (CN-AML) with R882H as the most common form. Mutations in DNMT3A have largely been associated with poorer prognosis, however this is not consistent across all studies. This may be a result of patient age or combining R882 and non-R882 mutations during analysis as studies have indicated independent mechanisms of action and differential prognostic implications for these mutation types. One study that independently analyzed R882 and non-R882 mutations showed R882 mutations were associated with poorer prognosis than patients with wildtype and non-R882 mutations, but only in older patients with AML.",18,variant,47,missense_variant,Missense Variant,SO:0001583,"A sequence variant, that changes one or more bases, resulting in a different amino acid sequence but where the length is preserved.",http://www.sequenceontology.org/browser/current_svn/term/SO:0001583,2,25457241,25457243,,,ENST00000264709.3,,,,,75,GRCh37,,,,,,
33,EGFR,1956,L858R,"EGFR L858R has long been recognized as a functionally significant mutation in cancer, and is one of the most prevalent single mutations in lung cancer. Best described in non-small cell lung cancer (NSCLC), the mutation seems to confer sensitivity to first and second generation TKI's like gefitinib and neratinib. NSCLC patients with this mutation treated with TKI's show increased overall and progression-free survival, as compared to chemotherapy alone. Third generation TKI's are currently in clinical trials that specifically focus on mutant forms of EGFR, a few of which have shown efficacy in treating patients that failed to respond to earlier generation TKI therapies.",19,variant,47,missense_variant,Missense Variant,SO:0001583,"A sequence variant, that changes one or more bases, resulting in a different amino acid sequence but where the length is preserved.",http://www.sequenceontology.org/browser/current_svn/term/SO:0001583,7,55259515,55259515,T,G,ENST00000275493.2,,,,,75,GRCh37,,,,,,
